"original_text","perturbed_text","original_score","perturbed_score","original_output","perturbed_output","ground_truth_output","num_queries","result_type"
"Contrary to other reviews, I have [[zero]] [[complaints]] about the service or the prices. I have been getting tire service here for the past 5 years now, and compared to my experience with places like Pep Boys, these guys are experienced and know what they're doing. \nAlso, this is one place that I do not feel like I am being taken advantage of, just because of my gender. Other auto mechanics have been notorious for capitalizing on my ignorance of cars, and have sucked my bank account dry. [[But]] here, my service and road coverage has all been well explained - and let up to me to [[decide]]. \nAnd they just renovated the waiting room. It looks a lot better than it did in previous years.","Contrary to other reviews, I have [[zbro]] [[comphlaints]] about the service or the prices. I have been getting tire service here for the past 5 years now, and compared to my experience with places like Pep Boys, these guys are experienced and know what they're doing. \nAlso, this is one place that I do not feel like I am being taken advantage of, just because of my gender. Other auto mechanics have been notorious for capitalizing on my ignorance of cars, and have sucked my bank account dry. [[Buo]] here, my service and road coverage has all been well explained - and let up to me to [[deride]]. \nAnd they just renovated the waiting room. It looks a lot better than it did in previous years.",0.005630195140838623,0.6921024322509766,1,0,1,79,"Successful"
"Last summer I had an appointment to get new tires and had to wait a super long time. I also went in this week for them to [[fix]] a minor problem with a tire they put on. They \""""fixed\"""" it for free, and the very [[next]] [[morning]] I had the same issue. I called to complain, and the \""""manager\"""" didn't [[even]] apologize!!! So [[frustrated]]. [[Never]] going back.  [[They]] [[seem]] [[overpriced]], too.","Last summer I had an appointment to get new tires and had to wait a super long time. I also went in this week for them to [[fxi]] a minor problem with a tire they put on. They \""""fixed\"""" it for free, and the very [[netx]] [[morniLng]] I had the same issue. I called to complain, and the \""""manager\"""" didn't [[egven]] apologize!!! So [[fruMtrated]]. [[NeveVr]] going back.  [[TZhey]] [[esem]] [[Averpriced]], too.",0.00023728609085083008,0.5946328043937683,0,1,0,98,"Successful"
"[[Friendly]] staff, same starbucks fair you get anywhere else.  Sometimes the lines can get long.","[[Fiendly]] staff, same starbucks fair you get anywhere else.  Sometimes the lines can get long.",0.03641539812088013,0.992143988609314,1,0,1,16,"Successful"
"[[The]] food is good. [[Unfortunately]] the service is very hit or miss. The main issue seems to be with the kitchen, the waiters and waitresses are [[often]] very apologetic for the long waits and it's pretty [[obvious]] that some of them avoid the [[tables]] after taking the initial order to avoid hearing complaints.","[[Teh]] food is good. [[Unfortunateyl]] the service is very hit or miss. The main issue seems to be with the kitchen, the waiters and waitresses are [[oten]] very apologetic for the long waits and it's pretty [[obvous]] that some of them avoid the [[Sables]] after taking the initial order to avoid hearing complaints.",0.013590514659881592,0.5472663640975952,0,1,0,49,"Successful"
"Even when we didn't have a car Filene's Basement was worth the bus trip to the Waterfront. I always find something (usually I find 3-4 things and spend about $60) and better still, I am always still wearing the clothes and shoes 3 months later. \n\nI kind of suspect this is the best shopping in Pittsburgh; it's much better than the usual department stores, better than Marshall's and TJ Maxx and better than the Saks downtown, even when it has a sale. Selection, bargains [[AND]] quality.\n\nI like this Filene's better than Gabriel Brothers, which are harder to get to. Gabriel Brothers are a real discount shopper's challenge and [[I'm]] afraid I didn't live in Pittsburgh long enough to develop the necessary skills . . . Filene's was [[still]] up and running in June 2007 when I [[left]] [[town]].","Even when we didn't have a car Filene's Basement was worth the bus trip to the Waterfront. I always find something (usually I find 3-4 things and spend about $60) and better still, I am always still wearing the clothes and shoes 3 months later. \n\nI kind of suspect this is the best shopping in Pittsburgh; it's much better than the usual department stores, better than Marshall's and TJ Maxx and better than the Saks downtown, even when it has a sale. Selection, bargains [[cAND]] quality.\n\nI like this Filene's better than Gabriel Brothers, which are harder to get to. Gabriel Brothers are a real discount shopper's challenge and [[I'gm]] afraid I didn't live in Pittsburgh long enough to develop the necessary skills . . . Filene's was [[till]] up and running in June 2007 when I [[Meft]] [[ftown]].",0.01689291000366211,0.7498304843902588,1,0,1,109,"Successful"
"Picture Billy Joel's \""""Piano Man\"""" DOUBLED mixed with beer, a rowdy crowd, and comedy - Welcome to Sing Sing!  A unique musical experience found in Homestead.\n\nIf you're looking to grab a bite to eat or a beer, come on in!  [[Serving]] food and brews from Rock Bottom [[Brewery]], Sing [[Sing]] [[keeps]] your tummy full while you listen to two (or more) amazingly talented pianists take your musical requests.  They'll play [[anything]] you'd like, for tips of course.  Wanting to hear Britney Spears?  Toto?  Duran Duran?  Yep, they play that... new or old.\n\nThe crowd makes the show, so make sure you come ready for a good time.  If the crowd is dead, it's harder for the Guys to get a reaction.  If you're wanting to have some fun, it can be a GREAT time!  It's the perfect place for Birthday parties - especially if you want to embarrass a friend.  The guys will bring them up to the pianos and perform a little ditty.  For being a good sport, you get the coveted Sing Sing bumper sticker.  Now who wouldn't want that?\n\nDueling Pianos and brews... time to Shut Up & Sing Sing!","Picture Billy Joel's \""""Piano Man\"""" DOUBLED mixed with beer, a rowdy crowd, and comedy - Welcome to Sing Sing!  A unique musical experience found in Homestead.\n\nIf you're looking to grab a bite to eat or a beer, come on in!  [[Serfving]] food and brews from Rock Bottom [[sBrewery]], Sing [[Sign]] [[kDeeps]] your tummy full while you listen to two (or more) amazingly talented pianists take your musical requests.  They'll play [[naything]] you'd like, for tips of course.  Wanting to hear Britney Spears?  Toto?  Duran Duran?  Yep, they play that... new or old.\n\nThe crowd makes the show, so make sure you come ready for a good time.  If the crowd is dead, it's harder for the Guys to get a reaction.  If you're wanting to have some fun, it can be a GREAT time!  It's the perfect place for Birthday parties - especially if you want to embarrass a friend.  The guys will bring them up to the pianos and perform a little ditty.  For being a good sport, you get the coveted Sing Sing bumper sticker.  Now who wouldn't want that?\n\nDueling Pianos and brews... time to Shut Up & Sing Sing!",0.0092049241065979,0.6039000153541565,1,0,1,144,"Successful"
"[[Mediocre]] [[service]]. [[COLD]] food! [[Our]] [[food]] [[waited]] so [[long]] the lettuce & [[pickles]] [[wilted]]. [[Bland]] [[food]]. [[Crazy]] [[overpriced]]. Long [[waits]] in the arcade. 1 beer [[per]] hour maximum.  Avoid at all costs. Fair manager.","[[Meidocre]] [[ervice]]. [[COLoD]] food! [[uOr]] [[fxood]] [[waitd]] so [[loTng]] the lettuce & [[piclkes]] [[wlited]]. [[lBand]] [[foMd]]. [[Crzay]] [[oveorpriced]]. Long [[Qaits]] in the arcade. 1 beer [[Rper]] hour maximum.  Avoid at all costs. Fair manager.",0.0002866387367248535,0.5190521478652954,0,1,0,94,"Successful"
"Ok! [[Let]] me [[tell]] you about my [[bad]] experience first. I went to D&B last night for a post wedding party - which, side note, is a great idea!\n\[[nIt]] was around midnight and the [[bar]] wasn't really populated. There were three bartenders and only [[one]] was actually making rounds to see if anyone needed anything. The two other bartenders were chatting on the far side of the [[bar]] that no [[one]] was sitting at. Kind of [[counter]] productive if you ask me. \n\nI stood there for about 5 minutes, which for a busy [[bar]] is fine but when I am the only one with my card out then, it just seems a little ridiculous. I made eye contact with the [[one]] girl twice and gave her a smile and she literally turned away. I finally had to walk to them to get their attention.  I was standing right in front of them smiling and they didn't ask if i need anything. I finally said, \""""Are you working?\"""" and they gave each other a weird look. I felt like i was the crazy one. I asked for a [[beer]]/got the [[beer]].\n\[[nIn]] between that time, the other bartender brought [[food]] over and set it down. She took a fry from the plate (right in front of me) and then served it to someone on the other side of the [[bar]]. [[What]] the hell! I felt like i was in some [[grimy]] [[bar]] in out in the sticks - not an established D&B. \n\nI was just really [[turned]] off from that experience. \n\[[nThe]] good is that D&B provides a different type of entertainment when you want to mix things up. I remember going here with my grandparents when I was a [[kid]] and it was the best treat ever! We would eat at the restaurant and then spend hours playing games. This [[place]] holds some really good memories for me. \n\[[nIt's]] a [[shame]] that my [[experience]] [[last]] [[night]] has spoiled the high [[standards]] I held for it.","Ok! [[LIt]] me [[tel]] you about my [[bay]] experience first. I went to D&B last night for a post wedding party - which, side note, is a great idea!\n\[[nIc]] was around midnight and the [[br]] wasn't really populated. There were three bartenders and only [[ne]] was actually making rounds to see if anyone needed anything. The two other bartenders were chatting on the far side of the [[br]] that no [[ne]] was sitting at. Kind of [[couter]] productive if you ask me. \n\nI stood there for about 5 minutes, which for a busy [[ba]] is fine but when I am the only one with my card out then, it just seems a little ridiculous. I made eye contact with the [[ne]] girl twice and gave her a smile and she literally turned away. I finally had to walk to them to get their attention.  I was standing right in front of them smiling and they didn't ask if i need anything. I finally said, \""""Are you working?\"""" and they gave each other a weird look. I felt like i was the crazy one. I asked for a [[bee]]/got the [[been]].\n\[[In]] between that time, the other bartender brought [[Wood]] over and set it down. She took a fry from the plate (right in front of me) and then served it to someone on the other side of the [[ar]]. [[hat]] the hell! I felt like i was in some [[grmy]] [[Car]] in out in the sticks - not an established D&B. \n\nI was just really [[urned]] off from that experience. \n\[[nThoe]] good is that D&B provides a different type of entertainment when you want to mix things up. I remember going here with my grandparents when I was a [[hid]] and it was the best treat ever! We would eat at the restaurant and then spend hours playing games. This [[plce]] holds some really good memories for me. \n\[[nIKt's]] a [[hsame]] that my [[exprience]] [[lRst]] [[nigh]] has spoiled the high [[kstandards]] I held for it.",0.002315998077392578,0.373096227645874,0,0,0,493,"Failed"
"I used to love D&B when it first opened in the Waterfront, but it has gone down [[hill]] over the [[years]]. The [[games]] are not as [[fun]] and do not [[give]] you as many [[tickets]] and the prizes have gotten cheaper in quality. It takes a whole heck of a lot of tickets for you to [[even]] get a [[pencil]]! The [[atmosphere]] is okay but it used to be so much [[better]] with the [[funnest]] games and diverse groups of people! Now, it is [[run]] down and many of the [[games]] are app related games ([[Fruit]] Ninja) and 3D Experience rides. With such \""""games\"""", you [[can't]] [[even]] earn tickets and they take a lot of [[tokens]]! Last [[time]] I went, back in the winter, many of the games were broken, which made for a [[negative]] player experience. I would go to D&B to [[play]] some [[games]] again in the [[future]], but it is no longer [[one]] of my favorite places to [[go]] due to the decline of fun [[games]] where you can earn tickets.","I used to love D&B when it first opened in the Waterfront, but it has gone down [[ihll]] over the [[yenrs]]. The [[Qames]] are not as [[hun]] and do not [[Ogive]] you as many [[tickevts]] and the prizes have gotten cheaper in quality. It takes a whole heck of a lot of tickets for you to [[eveq]] get a [[pencifl]]! The [[amosphere]] is okay but it used to be so much [[betser]] with the [[funnesN]] games and diverse groups of people! Now, it is [[ru]] down and many of the [[ames]] are app related games ([[FruiBt]] Ninja) and 3D Experience rides. With such \""""games\"""", you [[ca'nt]] [[evne]] earn tickets and they take a lot of [[tokes]]! Last [[tixme]] I went, back in the winter, many of the games were broken, which made for a [[negatPve]] player experience. I would go to D&B to [[cplay]] some [[gqames]] again in the [[fuutre]], but it is no longer [[oen]] of my favorite places to [[gio]] due to the decline of fun [[gamas]] where you can earn tickets.",0.0011259913444519043,0.10715466737747192,0,0,0,200,"Failed"
"[[Like]] any Barnes & Noble, it has a nice comfy cafe, and a large selection of books.  The staff is very friendly and helpful.  They stock a decent selection, and the prices are pretty reasonable.  [[Obviously]] it's [[hard]] for them to compete with Amazon.  [[However]] since all the small shop bookstores are gone, it's [[nice]] to walk into one [[every]] once in a while.","[[Lik]] any Barnes & Noble, it has a nice comfy cafe, and a large selection of books.  The staff is very friendly and helpful.  They stock a decent selection, and the prices are pretty reasonable.  [[Obvuously]] it's [[harx]] for them to compete with Amazon.  [[Howveer]] since all the small shop bookstores are gone, it's [[ice]] to walk into one [[evNery]] once in a while.",0.0005090236663818359,0.9050256609916687,1,0,1,58,"Successful"
"Meh, I've experienced [[better]] is an understatement.\n\[[nFriday's]] is like the \""""fine dining chain\"""" for every yinzer in Pittsburgh...\n\[[n1]].  When we were seated, it was quick which was a surprise.  Somehow this restaurant gets packed and I never [[understand]] why.  I was happy about that.\[[n2]].  I ordered one of their \""""skinny margaritas\"""", blackberry to be exact.  It was a nice size, [[however]], at $6.00/pop, that was half of my food bill.\[[n3]].  The waitress started off attentive, but after our [[food]] came out she was gone.  I ordered a turkey burger with [[pickle]] and mustard.  Loaded [[mashed]] [[potato]] on the side because I wanted [[heartburn]] ha!\[[n4]].  Food came.  My burger had [[lettuce]] on it only.  [[Waitress]] was supposed to [[go]] and get our next round of drinks.  I had to wait to ask for my [[pickle]].\[[n5]].  The loaded potatoes were more like rubber than potatoes and not what I was expecting.  Disappointment.\[[n6]].  The waitress then went into oblivion and only returned with our [[check]].  \n\[[nNever]] again will I [[eat]] at [[Friday's]].  I will, [[however]], [[go]] should a happy [[hour]] [[arise]]...","Meh, I've experienced [[beter]] is an understatement.\n\[[nFridNy's]] is like the \""""fine dining chain\"""" for every yinzer in Pittsburgh...\n\[[1n]].  When we were seated, it was quick which was a surprise.  Somehow this restaurant gets packed and I never [[undersand]] why.  I was happy about that.\[[2]].  I ordered one of their \""""skinny margaritas\"""", blackberry to be exact.  It was a nice size, [[Qhowever]], at $6.00/pop, that was half of my food bill.\[[ny3]].  The waitress started off attentive, but after our [[foo]] came out she was gone.  I ordered a turkey burger with [[piCckle]] and mustard.  Loaded [[masted]] [[potaNo]] on the side because I wanted [[heartmburn]] ha!\[[n]].  Food came.  My burger had [[lettue]] on it only.  [[Waitres]] was supposed to [[og]] and get our next round of drinks.  I had to wait to ask for my [[apickle]].\[[n]].  The loaded potatoes were more like rubber than potatoes and not what I was expecting.  Disappointment.\[[O6]].  The waitress then went into oblivion and only returned with our [[Qcheck]].  \n\[[nNevre]] again will I [[mat]] at [[Fiday's]].  I will, [[howevEer]], [[zo]] should a happy [[our]] [[aArise]]...",0.00046253204345703125,0.0038614869117736816,0,0,0,270,"Failed"
"Unos has been [[around]] for ever, & I feel like this restaurant chain peak in popularity in the 80's. Honestly the decor inside still kind of looks 80s to me even though its nice with sleek booth and exposed brick.\n\nIf you haven't [[died]] and he recently I ordered you to come back and have a meal here again because honestly the food is really quite [[good]]!\n\nThey have the best chicken salad wrap ever! I [[love]] that rap so [[much]] I want agreed to walk the south side River Trail from where the Steelers practice all the way to the damn waterfront just because I knew that I could convince my boyfriend to go to Unos with me for lunch.  Full disclosure:  I made him call is a cab and we took a taxi back to the parking lot after lunch.\n\nListen... The food and pizza and service are very good, [[surprisingly]] so! I don't know why this place is not busier but next time you're down at the Waterfront please do consider dining here!","Unos has been [[arBound]] for ever, & I feel like this restaurant chain peak in popularity in the 80's. Honestly the decor inside still kind of looks 80s to me even though its nice with sleek booth and exposed brick.\n\nIf you haven't [[dild]] and he recently I ordered you to come back and have a meal here again because honestly the food is really quite [[goKd]]!\n\nThey have the best chicken salad wrap ever! I [[lve]] that rap so [[mucfh]] I want agreed to walk the south side River Trail from where the Steelers practice all the way to the damn waterfront just because I knew that I could convince my boyfriend to go to Unos with me for lunch.  Full disclosure:  I made him call is a cab and we took a taxi back to the parking lot after lunch.\n\nListen... The food and pizza and service are very good, [[surprisiugly]] so! I don't know why this place is not busier but next time you're down at the Waterfront please do consider dining here!",0.0030041933059692383,0.8647509813308716,1,0,1,134,"Successful"
"Stars are for the food only.    2.5 rating\n\nGot there at 8pm on Saturday night, they told us it was an hour [[wait]] which was expected, but it only took 30minutes to be seated so that was a bonus.  Started off with the lettuce [[wraps]] and i used to be a [[fan]] of these but they just seem to bore me now([[FYI-love]] the lettuce wraps at the cheesecake factory).  I had the Singapore rice noodles.  This was so so as i thought immediately that lu lu noodles and asian cafe are better.  The fried rice was disappointing and the vegetables [[tasted]] [[raw]].   [[Some]] good notes were the Dynamite [[shrimp]], plump, juicy, tangy with a small kick.    Sweet and [[sour]] [[chicken]] was just the same minus the [[kick]]. \n\nThe service was [[annoying]].   We were there less than [[45]] minutes and it seemed like our [[waiter]] was in a rush to get [[us]] out of there.   Constantly asking if he could remove my plate.  I had to [[sternly]] say at one [[point]] that I will let you know when i am [[finished]].  I found it [[rude]] especially since  there wasn't [[even]] a [[line]] at this point.  \n\[[nI]] think we will travel elsewhere following a movie.  The result [[never]] quite met the anticipation.","Stars are for the food only.    2.5 rating\n\nGot there at 8pm on Saturday night, they told us it was an hour [[wit]] which was expected, but it only took 30minutes to be seated so that was a bonus.  Started off with the lettuce [[wrpas]] and i used to be a [[faj]] of these but they just seem to bore me now([[FYe-love]] the lettuce wraps at the cheesecake factory).  I had the Singapore rice noodles.  This was so so as i thought immediately that lu lu noodles and asian cafe are better.  The fried rice was disappointing and the vegetables [[atsted]] [[aw]].   [[SomV]] good notes were the Dynamite [[shXrimp]], plump, juicy, tangy with a small kick.    Sweet and [[sou]] [[chicen]] was just the same minus the [[ikck]]. \n\nThe service was [[avnoying]].   We were there less than [[54]] minutes and it seemed like our [[water]] was in a rush to get [[u]] out of there.   Constantly asking if he could remove my plate.  I had to [[tsernly]] say at one [[Spoint]] that I will let you know when i am [[fnished]].  I found it [[ryde]] especially since  there wasn't [[eve]] a [[ilne]] at this point.  \n\[[In]] think we will travel elsewhere following a movie.  The result [[nevuer]] quite met the anticipation.",0.0003514289855957031,0.28490275144577026,0,0,0,410,"Failed"
"Our last few visits have left something to desire, One of the things I always notice is the demeanor of an establishments employees. These people look miserable, no one smiles or greets you appropriately, it's more like get in, get out, turn the tables,\n\nThe [[food]] has remained consistently good... when we can order it. the last time JB and I came for a quick dinner, the place was not busy yet we were passed by 6 frowning [[waitstaff]] [[without]] getting drinks... for 15 [[minutes]] we were [[left]] suiting at our table with our menus closed and sitting on the edge of the table (HINT, HINT) so we [[left]] and most [[likely]] will not be [[returning]].","Our last few visits have left something to desire, One of the things I always notice is the demeanor of an establishments employees. These people look miserable, no one smiles or greets you appropriately, it's more like get in, get out, turn the tables,\n\nThe [[fooI]] has remained consistently good... when we can order it. the last time JB and I came for a quick dinner, the place was not busy yet we were passed by 6 frowning [[waisttaff]] [[wtihout]] getting drinks... for 15 [[minuts]] we were [[let]] suiting at our table with our menus closed and sitting on the edge of the table (HINT, HINT) so we [[elft]] and most [[likcely]] will not be [[rturning]].",0.0003069639205932617,0.5360735058784485,0,1,0,98,"Successful"
"[[Good]] [[quality]] pork fried dumpling and mongo beef.  Bar service was fast and Efficent.   Good value.  Not a 5 cause dragon eye tea was cold first time around and beef had [[minor]] amount of fat.   Fortune was even Postive!","[[GooEd]] [[qality]] pork fried dumpling and mongo beef.  Bar service was fast and Efficent.   Good value.  Not a 5 cause dragon eye tea was cold first time around and beef had [[minro]] amount of fat.   Fortune was even Postive!",0.003895878791809082,0.6965738534927368,1,0,1,43,"Successful"
"Very [[bad]] [[purchase]] [[experience]]. I [[bought]] a [[shirt]] with a hole covered in the rolled up sleeves, but they [[denied]] my [[request]] to [[return]] it. I am so angery at this and will never [[shop]] their chothes anymore.","Very [[lad]] [[purcase]] [[expRerience]]. I [[bouzht]] a [[shit]] with a hole covered in the rolled up sleeves, but they [[denjied]] my [[rquest]] to [[eturn]] it. I am so angery at this and will never [[shpo]] their chothes anymore.",0.00028187036514282227,0.5302258729934692,0,1,0,60,"Successful"
