"original_text","perturbed_text","original_score","perturbed_score","original_output","perturbed_output","ground_truth_output","num_queries","result_type"
"[[BED]] BUGS!!! Horrible place! DO NOT [[STAY]] HERE!! [[Stayed]] here for a wedding we [[attended]]. [[Woke]] up in the [[middle]] of the [[night]] with bites all over my [[legs]], arms, and [[back]]. [[We]] flip a [[pillow]] over and there it was. BED [[BUGS]]. We had to cut our [[trip]] short. The man at the front desk apologized and gave us the managers name and number and told us to call [[back]] later that morning. We have been calling since 8/[[10]] and have yet to [[receive]] a [[call]] [[back]]. [[Such]] disrespect. [[We]] risk [[bringing]] [[back]] bed bugs and spending [[hundreds]] on extermination fees and no has the decency to [[call]] [[back]].","[[BE]] BUGS!!! Horrible place! DO NOT [[STYA]] HERE!! [[Mtayed]] here for a wedding we [[ttended]]. [[WoHe]] up in the [[miaddle]] of the [[nigth]] with bites all over my [[elgs]], arms, and [[zack]]. [[eW]] flip a [[piNlow]] over and there it was. BED [[BGUS]]. We had to cut our [[rip]] short. The man at the front desk apologized and gave us the managers name and number and told us to call [[baGk]] later that morning. We have been calling since 8/[[L10]] and have yet to [[Deceive]] a [[cXall]] [[Vback]]. [[Sukch]] disrespect. [[me]] risk [[bringdng]] [[bmck]] bed bugs and spending [[hundrDeds]] on extermination fees and no has the decency to [[cAall]] [[bAack]].",0.0002689957618713379,0.0014047026634216309,0,0,0,192,"Failed"
"I had not been to Betos in many many years.  Boy has the place grown up.  Still the same pizza that you will either love or hate.\n\nThe Pizza here has the chesse and topings put on after they cook it so it melts some while you eat it.  Tastes really [[good]].  \n\nI also has the apetizer sampler which was a lot of food for two people.\n\n\nWas not to crowded, but full Saturday at lunch.\n\nHighly [[recommended]].","I had not been to Betos in many many years.  Boy has the place grown up.  Still the same pizza that you will either love or hate.\n\nThe Pizza here has the chesse and topings put on after they cook it so it melts some while you eat it.  Tastes really [[goo]].  \n\nI also has the apetizer sampler which was a lot of food for two people.\n\n\nWas not to crowded, but full Saturday at lunch.\n\nHighly [[ecommended]].",0.0019902586936950684,0.9989572167396545,1,0,1,53,"Successful"
"A different style (love or hate) pizza. A square cut thicker crust with cold shredded cheese on top. It's different enough that it is a good chance of pace to your standard pie.","A different style (love or hate) pizza. A square cut thicker crust with cold shredded cheese on top. It's different enough that it is a good chance of pace to your standard pie.",0.9335187077522278,0.9335187077522278,0,0,1,1,"Skipped"
"[[Great]] shop! Watched them make their waffle comes right in the shop and they are [[delish]]!\n\nTried the salted caramel and was surprised to find little chocolate covered caramels inside! [[Yum]]!","[[Gerat]] shop! Watched them make their waffle comes right in the shop and they are [[deish]]!\n\nTried the salted caramel and was surprised to find little chocolate covered caramels inside! [[um]]!",0.0009702444076538086,0.9947375059127808,1,0,1,34,"Successful"
"I will [[never]] forget Campiti's. [[As]] a youngster growing up playing on Potomac Avenue and Dormont. My [[favorite]] pizza was and [[still]] is Campiti's. I have not found an equal in the 18 years I have been in CA. The [[hoagies]] were pretty damn [[good]] too.","I will [[nevjer]] forget Campiti's. [[s]] a youngster growing up playing on Potomac Avenue and Dormont. My [[favoritVe]] pizza was and [[Itill]] is Campiti's. I have not found an equal in the 18 years I have been in CA. The [[haogies]] were pretty damn [[ogod]] too.",0.0012369155883789062,0.8359698057174683,1,0,1,64,"Successful"
"[[Agree]] with chaitiyana. [[This]] place is pretty [[bad]]. The [[food]] isn't fresh. [[They]] have a Buffet even for dinner. I stayed at Days Inn for [[2wks]] here and was [[forced]] to eat here a few [[times]]. [[The]] mango lassi was good, the naans (when fresh) were [[good]], but mostly it all [[stunk]].","[[Agrede]] with chaitiyana. [[ThiV]] place is pretty [[baJ]]. The [[foo]] isn't fresh. [[hTey]] have a Buffet even for dinner. I stayed at Days Inn for [[2wkYs]] here and was [[frced]] to eat here a few [[tyimes]]. [[Teh]] mango lassi was good, the naans (when fresh) were [[ugood]], but mostly it all [[stYunk]].",0.0002980828285217285,0.5796964168548584,0,1,0,79,"Successful"
"got the buffet pizza was [[good]] they also give you free soup to .","got the buffet pizza was [[goad]] they also give you free soup to .",0.002878844738006592,0.9735788702964783,1,0,1,13,"Successful"
"I had a [[positive]] experience with this shop. I needed something framed at the last minute, and within extremely precise parameters (that weren't easy to abide by), and they not only got the work done correctly and on time, but at a reasonable price. \n\nThe staff is a little gruff, but not at all unfriendly, and I am [[happy]] to have found a local shop that I will return to.","I had a [[opsitive]] experience with this shop. I needed something framed at the last minute, and within extremely precise parameters (that weren't easy to abide by), and they not only got the work done correctly and on time, but at a reasonable price. \n\nThe staff is a little gruff, but not at all unfriendly, and I am [[hamppy]] to have found a local shop that I will return to.",0.0004792213439941406,0.9580780267715454,1,0,1,45,"Successful"
"Cons:\n* Very cramped space, [[aisles]] are so narrow that you have to [[carry]] your [[case]] sideways.\n* [[Only]] a few [[items]] were priced with [[signs]] [[hanging]] above them.\n* [[No]] shopping carts.\n\[[nPros]]:\[[n*]] Decent selection\n* [[Chilled]] section","Cons:\n* Very cramped space, [[ailses]] are so narrow that you have to [[crry]] your [[casme]] sideways.\n* [[nOly]] a few [[itesm]] were priced with [[sigs]] [[hangVing]] above them.\n* [[oN]] shopping carts.\n\[[nPOos]]:\[[ny]] Decent selection\n* [[ChilleCd]] section",0.03571981191635132,0.5077600479125977,0,1,0,85,"Successful"
"I lived in Pittsburgh for four years and have never been to D's, but I visited recently and went with some friends. What lured me was the promise of veggie dogs and burgers, and I was not [[let]] down. I got two hot dogs--a Chicago and a mac and cheese. Really, really [[good]]. My boyfriend ordered the Red Alert dog (his was meat) and his face basically melted off, but he insisted he loved it. Then he said the spices may or may not have traveled to his tear ducts, but to each his own. He had a [[great]] time. My two friends also got the mac and cheese veggie dog and loved it. \nThe beer cave is awesome. \nI'd love to give D's five stars, but like a couple of people mentioned, the service is lacking. Everyone is friendly, but I had to walk around and find our server so I could pay, and then find him again when he didn't return. It took us a while to get water refills, too. The dining area and the bar are separated, and it seems like the servers congregate in one place and leave the other vacant at any given time. Very nice people though.","I lived in Pittsburgh for four years and have never been to D's, but I visited recently and went with some friends. What lured me was the promise of veggie dogs and burgers, and I was not [[le]] down. I got two hot dogs--a Chicago and a mac and cheese. Really, really [[goo]]. My boyfriend ordered the Red Alert dog (his was meat) and his face basically melted off, but he insisted he loved it. Then he said the spices may or may not have traveled to his tear ducts, but to each his own. He had a [[greakt]] time. My two friends also got the mac and cheese veggie dog and loved it. \nThe beer cave is awesome. \nI'd love to give D's five stars, but like a couple of people mentioned, the service is lacking. Everyone is friendly, but I had to walk around and find our server so I could pay, and then find him again when he didn't return. It took us a while to get water refills, too. The dining area and the bar are separated, and it seems like the servers congregate in one place and leave the other vacant at any given time. Very nice people though.",0.003437936305999756,0.7780517339706421,1,0,1,134,"Successful"
"Something different here.\n\nFood, schmood, go there and drink the beers from the beer cave.  I don't think you have to wait for the server to open your beer, they'll notice and charge your accordingly.  It's all walk in and self service beer, why don't more places do that?!\n\nMike","Something different here.\n\nFood, schmood, go there and drink the beers from the beer cave.  I don't think you have to wait for the server to open your beer, they'll notice and charge your accordingly.  It's all walk in and self service beer, why don't more places do that?!\n\nMike",0.9335920214653015,0.9335920214653015,0,0,1,1,"Skipped"
"It's got it's ups and downs.  It's got a reasonably attractive interior, antique tin ceilings, a broad selection of dozens of beers and a tasty looking menu featuring daily specials.  [[So]] why my low score?  D's at the other end of the block puts their beer collection to shame offering 1000 beers,  Both [[times]] I've eaten here the wait to be served has been extremely slow (at least 30 minutes and up) the prices are a bit high ($10-$15 for a lunch entree) and most [[importantly]] the [[food]] is in general heavy and [[bland]].  [[This]] is not a [[terrible]] [[place]], but with so many delicious [[spots]] nearby in regent square like the green mango, map room, d's and the square cafe you should keep on walking.  That said, if you wanted a quiet spot to grab a beer with a friend, you [[could]] definitely do worse, but skip the boring [[food]].","It's got it's ups and downs.  It's got a reasonably attractive interior, antique tin ceilings, a broad selection of dozens of beers and a tasty looking menu featuring daily specials.  [[SJ]] why my low score?  D's at the other end of the block puts their beer collection to shame offering 1000 beers,  Both [[timNs]] I've eaten here the wait to be served has been extremely slow (at least 30 minutes and up) the prices are a bit high ($10-$15 for a lunch entree) and most [[importntly]] the [[fTood]] is in general heavy and [[land]].  [[his]] is not a [[tOerrible]] [[lace]], but with so many delicious [[spYts]] nearby in regent square like the green mango, map room, d's and the square cafe you should keep on walking.  That said, if you wanted a quiet spot to grab a beer with a friend, you [[coul]] definitely do worse, but skip the boring [[ofod]].",0.0004628896713256836,0.7470548152923584,0,1,0,143,"Successful"
"Food is [[delicious]] and staff is very [[prompt]].  \n\nThe one thing I absolutely [[love]] about this restaurant is how [[clean]] the bathroom is!!!  I was completely stunned and [[amazed]] when I [[walked]] in.","Food is [[deicious]] and staff is very [[rompt]].  \n\nThe one thing I absolutely [[lvove]] about this restaurant is how [[flean]] the bathroom is!!!  I was completely stunned and [[amzaed]] when I [[alked]] in.",0.0016155242919921875,0.6587927341461182,1,0,1,53,"Successful"
"I got two pairs of shoes fixed here recently and I was very [[pleased]] with the work done and the cost.  It is a [[great]] little business to have in the neighborhood! \nMake [[sure]] you call and check their hours... Saturdays are probably your best bet.","I got two pairs of shoes fixed here recently and I was very [[pleaxsed]] with the work done and the cost.  It is a [[grNeat]] little business to have in the neighborhood! \nMake [[usre]] you call and check their hours... Saturdays are probably your best bet.",0.0010156035423278809,0.9221442341804504,1,0,1,38,"Successful"
"[[BEST]] SUBS EVER.  Seriously.  We saw this on \""""PA n'at with Dave and Dave\"""" and it looks awesome.  We took the drive to Swissvale and got us a \""""Battleship\"""" and it was literally 3 feet long, just the right amount of veggies and meat and [[delicious]].  It was 2 meals worth of food (for two people).  [[Even]] better the next day.  And the best part was that it was under 13 bucks.  \n\nIt's [[great]], fast food.  I [[can't]] [[wait]] to bring friends there to enjoy their selection of 40s along with a Battleship.","[[BST]] SUBS EVER.  Seriously.  We saw this on \""""PA n'at with Dave and Dave\"""" and it looks awesome.  We took the drive to Swissvale and got us a \""""Battleship\"""" and it was literally 3 feet long, just the right amount of veggies and meat and [[deliciHus]].  It was 2 meals worth of food (for two people).  [[Evn]] better the next day.  And the best part was that it was under 13 bucks.  \n\nIt's [[greht]], fast food.  I [[canJt]] [[waiCt]] to bring friends there to enjoy their selection of 40s along with a Battleship.",0.002161681652069092,0.9900291562080383,1,0,1,84,"Successful"
"[[This]] place is [[okay]]. The [[waiter]] was [[horrible]] and [[barely]] checked on [[us]]. [[The]] [[food]] was [[also]] not too [[good]]. [[It]] was very [[bland]] and didn't have a [[lot]] of [[taste]] to it. I will not be [[coming]] [[back]].","[[Thias]] place is [[okaO]]. The [[waiNter]] was [[horrsble]] and [[Uarely]] checked on [[su]]. [[Th]] [[fod]] was [[lso]] not too [[gokod]]. [[tI]] was very [[land]] and didn't have a [[ulot]] of [[Ytaste]] to it. I will not be [[xcoming]] [[ack]].",0.0002556443214416504,0.6618081331253052,0,1,0,97,"Successful"
"The [[worst]] pulled pork sandwich I have ever had.    Their watermelon mixed drink was very good though.  I won't be [[returning]].","The [[orst]] pulled pork sandwich I have ever had.    Their watermelon mixed drink was very good though.  I won't be [[retunring]].",0.0002631545066833496,0.9829004406929016,0,1,0,24,"Successful"
"Being born and raised into an all Italian family, I'm pretty darn picky about my pastas and gravy (tomato sauce for the unknowing). My great [[grandmother's]] sauce was the first I remember, she never opened a can to make her sauces, always using tomatoes she canned herself in mason jars. She [[simmered]] her sauces until every seed melted away. My mother's sauce was a bit more thicker, using puree and paste as a base, later adding whole peeled tomatoes, garlic and fresh basil. Her [[sauce]] cooks down to a velvety pasta sauce that should be jarred and sold on super market shelves.\n\nSorry on to my review of Olive Garden. seriously? Really? [[No]]! I will admit it's good in a fit of really, REALLY needing a pasta fix, or if you want to eat breadstick and salad. [[But]] the sauces are overly rich, and I don't mean the tomato sauces. I mean the sauces they put over the pasta with chicken, beef or fish. And, let me be real Italian here, pasta is [[NEVER]] the main meal in an Italian supper, Pasta is normally the first course and NEVER served with meat, including MEATBALLS. Thats as American as fortune cookies. after pasta, comes the protein, that includes meatballs, then finally salad.\n\nOkay, I'm done being a snooty Italian who looks down upon Olive Garden, I got out all my frustrations on you, my readers. But seriously, if you [[want]] good Italian food, hit up a REALLY good neighborhood, family owned Italian restaurant. The service is better, it will be cheaper and it won't go to a big conglomerate who over charges on a plate of pasta, which is one of the cheapest food you can serve. Oh, [[two]] stars for a pretty good bowl of Pasta Fazoo (pasta and beans).","Being born and raised into an all Italian family, I'm pretty darn picky about my pastas and gravy (tomato sauce for the unknowing). My great [[grandmotDer's]] sauce was the first I remember, she never opened a can to make her sauces, always using tomatoes she canned herself in mason jars. She [[simmeerd]] her sauces until every seed melted away. My mother's sauce was a bit more thicker, using puree and paste as a base, later adding whole peeled tomatoes, garlic and fresh basil. Her [[Vsauce]] cooks down to a velvety pasta sauce that should be jarred and sold on super market shelves.\n\nSorry on to my review of Olive Garden. seriously? Really? [[RNo]]! I will admit it's good in a fit of really, REALLY needing a pasta fix, or if you want to eat breadstick and salad. [[ut]] the sauces are overly rich, and I don't mean the tomato sauces. I mean the sauces they put over the pasta with chicken, beef or fish. And, let me be real Italian here, pasta is [[NXVER]] the main meal in an Italian supper, Pasta is normally the first course and NEVER served with meat, including MEATBALLS. Thats as American as fortune cookies. after pasta, comes the protein, that includes meatballs, then finally salad.\n\nOkay, I'm done being a snooty Italian who looks down upon Olive Garden, I got out all my frustrations on you, my readers. But seriously, if you [[awnt]] good Italian food, hit up a REALLY good neighborhood, family owned Italian restaurant. The service is better, it will be cheaper and it won't go to a big conglomerate who over charges on a plate of pasta, which is one of the cheapest food you can serve. Oh, [[tRwo]] stars for a pretty good bowl of Pasta Fazoo (pasta and beans).",0.0047515034675598145,0.5966261625289917,0,1,0,222,"Successful"
"[[Great]] [[bagels]], sandwiches, soup, and coffee!\nMy [[favorites]] are the veg-out bagel sandwich, the bagel dog on onion, and their sour cream potato salad is so [[good]] too.\nIf you like all beef hotdogs, you should try the bagel dog. They [[wrap]] bagel [[around]] the dog. [[When]] they heat it up, the juice soaks into that chewy bagel and it is [[heaven]].  [[Mmm]].","[[Greav]] [[bgels]], sandwiches, soup, and coffee!\nMy [[qfavorites]] are the veg-out bagel sandwich, the bagel dog on onion, and their sour cream potato salad is so [[ogod]] too.\nIf you like all beef hotdogs, you should try the bagel dog. They [[wrRp]] bagel [[raound]] the dog. [[Wqen]] they heat it up, the juice soaks into that chewy bagel and it is [[heaJen]].  [[Mfm]].",0.0009826421737670898,0.8647239804267883,1,0,1,87,"Successful"
"[[There]] is serious separation anxiety when you have to leave your stylist, with whom you have established a bond, and maybe even spilled serious personal information to. \n\nHaving [[moved]] from the south, I had to leave a woman I loved and strike out into all new territory. [[It]] was the end of a 2 year relationship, and I wasn't prepared to see just any old body after that. \n\nThen I [[found]] [[Nicolette]] at [[MCN]]. She's amazing and chill and friendly and interesting and and AND she's great at her job. Also, the salon is beautiful and the stylists range in price, so if you are occasionally living from paycheck to paycheck (like me,) you can see [[Jenn]] or Kara and get a great cut [[without]] having to scrounge through your piggy bank for a little extra.\n\nHowever, if you don't like dogs, be aware that Josie, the bulldog, is frequently around and about.","[[TherUe]] is serious separation anxiety when you have to leave your stylist, with whom you have established a bond, and maybe even spilled serious personal information to. \n\nHaving [[movRed]] from the south, I had to leave a woman I loved and strike out into all new territory. [[Ig]] was the end of a 2 year relationship, and I wasn't prepared to see just any old body after that. \n\nThen I [[fIund]] [[NicoleWte]] at [[CMN]]. She's amazing and chill and friendly and interesting and and AND she's great at her job. Also, the salon is beautiful and the stylists range in price, so if you are occasionally living from paycheck to paycheck (like me,) you can see [[enn]] or Kara and get a great cut [[withLut]] having to scrounge through your piggy bank for a little extra.\n\nHowever, if you don't like dogs, be aware that Josie, the bulldog, is frequently around and about.",0.0012586712837219238,0.602582573890686,1,0,1,119,"Successful"
"I booked a [[hair]] apt here after reading some of the reviews on Yelp, hoping I'd find a place to get my hair cut after moving to Pittsburgh from NJ. Maybe it was just the hairdresser I booked an appointment with, but I did not have a [[great]] [[experience]]. I'm a nurse who works mostly day shifts, and I value sleep over styling my hair in the morning. I tried to articulate that I wanted a [[hair]] [[cut]] that [[required]] minimal styling on my part. The [[hairdresser]] immediately shot me down, asking me how I expected to have my [[hair]] look nice if I wasn't willing to put work into it. [[She]] then berated me for not using styling products-- again, I'd rather [[sleep]]. \n\nNow, maybe a few people feel differently about their hair, but all I wanted was a [[cut]] that allowed for minimal styling on my part. I wasn't asking for some trendy 'do that needed 3 different products, a round brush, and a flat iron in order to re-create it. I ended up getting almost the same exact cut I had going in there (just an inch shorter). Oh, and she [[also]] told me the [[cut]] I had coming in wasn't entirely [[flattering]] because of it's blunt ends--- funny, I ended up with the same thing. \n\nThis experience has definitely made me decide [[never]] to [[go]] [[back]], for $[[50]] I expect a little [[bit]] better service and a little bit nicer treatment. Oh, and [[somewhere]] that isn't [[constantly]] pushing [[products]].","I booked a [[hai]] apt here after reading some of the reviews on Yelp, hoping I'd find a place to get my hair cut after moving to Pittsburgh from NJ. Maybe it was just the hairdresser I booked an appointment with, but I did not have a [[greta]] [[experiecne]]. I'm a nurse who works mostly day shifts, and I value sleep over styling my hair in the morning. I tried to articulate that I wanted a [[air]] [[ut]] that [[zequired]] minimal styling on my part. The [[hairdrsser]] immediately shot me down, asking me how I expected to have my [[air]] look nice if I wasn't willing to put work into it. [[che]] then berated me for not using styling products-- again, I'd rather [[selep]]. \n\nNow, maybe a few people feel differently about their hair, but all I wanted was a [[uct]] that allowed for minimal styling on my part. I wasn't asking for some trendy 'do that needed 3 different products, a round brush, and a flat iron in order to re-create it. I ended up getting almost the same exact cut I had going in there (just an inch shorter). Oh, and she [[aso]] told me the [[ct]] I had coming in wasn't entirely [[flatterimg]] because of it's blunt ends--- funny, I ended up with the same thing. \n\nThis experience has definitely made me decide [[neevr]] to [[og]] [[bakc]], for $[[05]] I expect a little [[it]] better service and a little bit nicer treatment. Oh, and [[somewhQre]] that isn't [[constntly]] pushing [[proEucts]].",0.00031363964080810547,0.001116335391998291,0,0,0,265,"Failed"
"[[Very]] [[sloppy]]! [[No]] attention the [[polish]] is all over my [[fingers]] so [[disappointing]] and [[aggravating]] that now I'm going to have to [[pay]] more [[money]] else where to [[get]] them redone","[[Vey]] [[loppy]]! [[Mo]] attention the [[polsh]] is all over my [[fGngers]] so [[dsappointing]] and [[gagravating]] that now I'm going to have to [[pah]] more [[monUy]] else where to [[gte]] them redone",0.00027745962142944336,0.5291349291801453,0,1,0,59,"Successful"
